{"approval_ref":null,"approval_status":"DRAFT","content_sha256":"695099d13e9ff6cf9b720a584e028a6e170e981c4d8a3d26d1f4a0561eaebc5c","edges":[{"basis_refs":["static:r004:bed91c8bd56d113a4c6efe80877c05a5292f710145d6ef20b6ece69f97af988a","manual-topology:PROPOSED"],"direction":"BIDIRECTIONAL","edge_id":"E_OUT_VEST","regions":["OUT_W","VEST_W"],"state":"UNKNOWN","traversability":"TOPOLOGICAL_ONLY","via":{"kind":"PORTAL","ref":"R004_WEST_ENTRY"}},{"basis_refs":["static:r004:bed91c8bd56d113a4c6efe80877c05a5292f710145d6ef20b6ece69f97af988a","manual-topology:PROPOSED"],"direction":"BIDIRECTIONAL","edge_id":"E_VEST_CORR","regions":["VEST_W","CORR_W"],"state":"UNKNOWN","traversability":"TOPOLOGICAL_ONLY","via":{"kind":"ADJACENT","ref":"WALK_VEST_W/WALK_CORR_W"}},{"basis_refs":["static:r004:bed91c8bd56d113a4c6efe80877c05a5292f710145d6ef20b6ece69f97af988a","manual-topology:PROPOSED"],"direction":"BIDIRECTIONAL","edge_id":"E_W_CORNER","regions":["CORR_W","CORNER"],"state":"UNKNOWN","traversability":"TOPOLOGICAL_ONLY","via":{"kind":"ADJACENT","ref":"WALK_CORR_W/WALK_CORNER"}},{"basis_refs":["static:r004:bed91c8bd56d113a4c6efe80877c05a5292f710145d6ef20b6ece69f97af988a","manual-topology:PROPOSED"],"direction":"BIDIRECTIONAL","edge_id":"E_CORNER_N","regions":["CORNER","CORR_N"],"state":"UNKNOWN","traversability":"TOPOLOGICAL_ONLY","via":{"kind":"ADJACENT","ref":"WALK_CORNER/WALK_CORR_N"}},{"basis_refs":["static:r004:bed91c8bd56d113a4c6efe80877c05a5292f710145d6ef20b6ece69f97af988a","manual-topology:PROPOSED"],"direction":"BIDIRECTIONAL","edge_id":"E_PORTAL_R101","regions":["CORR_W","R101"],"state":"UNKNOWN","traversability":"TOPOLOGICAL_ONLY","via":{"kind":"PORTAL","ref":"PORTAL_R101"}},{"basis_refs":["static:r004:bed91c8bd56d113a4c6efe80877c05a5292f710145d6ef20b6ece69f97af988a","manual-topology:PROPOSED"],"direction":"BIDIRECTIONAL","edge_id":"E_PORTAL_R102","regions":["CORR_N","R102"],"state":"UNKNOWN","traversability":"TOPOLOGICAL_ONLY","via":{"kind":"PORTAL","ref":"PORTAL_R102"}}],"graph_id":"rgraph:r004:static:695099d13e9ff6cf","inputs":[{"ref":"static:r004:proposal","sha256":"bed91c8bd56d113a4c6efe80877c05a5292f710145d6ef20b6ece69f97af988a"},{"ref":"calibration:r004:catalog","sha256":"3eba8572e5a3992b5786cb56ded79a47f00bfc2b6d0ae74878e8f4176b4b899f"},{"ref":"static-membership:r004:v2","sha256":"e71f6ad16868ab450bcd093eb50f6fd7ca4a393c73689055235e9505f9e48ca7"},{"ref":"portal-openings:r004:v2","sha256":"72e8ebb844e4c78235bfff5451639fe9e8fa3e7ef8f9eed1596679891cd1e64f"},{"ref":"static-patches:r004:v2","sha256":"103f312620da00fd73adc983b49dd006fe223ec119ef7f6e6828f72410ac34c5"},{"ref":"static-patches:r004:v3","sha256":"2f306b1e4d20524d44c2f80bd1e146d5ee63a018b860c86965da22e004f80f09"},{"ref":"tracking-scope:r004:v3","sha256":"01771904fffeeae1676bdfe22d87a38d17182fe7260269f42764df061aa56cfd"}],"regions":[{"floor_id":"FLOOR_GROUND","kind":"OUTDOOR","polygon_ref":"region-mesh:r004:OUT_W","polygon_sha256":"3b8a6927188485117d1362074dc8087f8261d4261127315e465f76623e4bf055","region_id":"OUT_W","walk_ids":["R004_EXTERIOR_FLOOR"]},{"floor_id":"FLOOR_GROUND","kind":"ENTRANCE","polygon_ref":"region-mesh:r004:VEST_W","polygon_sha256":"4ee615f5619da310ed4c2b6015922eda45e97132f327945c8064511b7ff97849","region_id":"VEST_W","walk_ids":["WALK_VEST_W"]},{"floor_id":"FLOOR_GROUND","kind":"CORRIDOR_SEGMENT","polygon_ref":"region-mesh:r004:CORR_W","polygon_sha256":"4d2e651a50820e07a77ad60974785d8700a4d716cda5bae4ec3a382579810253","region_id":"CORR_W","walk_ids":["WALK_CORR_W"]},{"floor_id":"FLOOR_GROUND","kind":"CORNER","polygon_ref":"region-mesh:r004:CORNER","polygon_sha256":"40932feadebb0118bba9c06c1116372edf4259d70e2e414830bc69e31fe3d387","region_id":"CORNER","walk_ids":["WALK_CORNER"]},{"floor_id":"FLOOR_GROUND","kind":"CORRIDOR_SEGMENT","polygon_ref":"region-mesh:r004:CORR_N","polygon_sha256":"a7cdd20f4791d587eeafb7929a6db7ddfee9e9abeae6b0cc0c78b3cb0edae496","region_id":"CORR_N","walk_ids":["WALK_CORR_N"]},{"floor_id":"FLOOR_GROUND","kind":"ROOM","polygon_ref":"region-mesh:r004:R101","polygon_sha256":"a2c791e6d75528f398b3ba880bd7b7090670153724013cf74bde048e2b0a5b21","region_id":"R101","walk_ids":["WALK_R101"]},{"floor_id":"FLOOR_GROUND","kind":"ROOM","polygon_ref":"region-mesh:r004:R102","polygon_sha256":"cd48d1eba659a6d491d363de0995ee9b691f9cd39a48771358bd3c18a767b14b","region_id":"R102","walk_ids":["WALK_R102"]}],"scene_id":"controlled_scene_v1_s001","scene_revision":"r004","scene_static_sha256":"bed91c8bd56d113a4c6efe80877c05a5292f710145d6ef20b6ece69f97af988a","schema_version":"q-demo.region-graph.v1"}
